{
  "schema": "codex-scientiae/article/0.1",
  "state": "source-ready",
  "slug": "2503.23653v2",
  "initialized_utc": "2026-08-11T08:29:53.804988Z",
  "title": null,
  "authors": [],
  "abstract": null,
  "identifiers": {
    "arxiv": null,
    "arxiv_versioned": null,
    "doi": null
  },
  "categories": [],
  "primary_category": null,
  "published": null,
  "updated": null,
  "evidence": {
    "provider_metadata": [],
    "latex_source": {
      "entrypoint": "main.tex",
      "selection": "single-candidate",
      "declarations": {
        "title_tex": "Scalable Geometric Learning with Correlation-Based Functional Brain Networks",
        "authors_tex": [
          "Kisung You",
          "Yelim Lee",
          "Hae-Jeong Park"
        ],
        "doi": null
      }
    },
    "package_control_files": []
  },
  "source_forms": [
    {
      "role": "latex-source-archive",
      "path": "2503.23653v2.tar.gz",
      "format": "application/gzip",
      "bytes": 13892388,
      "sha256": "af6fe1d638ae354e42707774c5a232161a21727690e7f56e34237f6c62949fd3",
      "archive_kind": "tar+gzip"
    },
    {
      "role": "latex-source-tree",
      "path": "2503.23653v2-tex",
      "format": "application/x-latex-source-tree",
      "derived_from": "2503.23653v2.tar.gz",
      "entrypoint": "main.tex",
      "entrypoint_selection": "single-candidate",
      "files": 29,
      "tex_files": 1,
      "sha256": "85bf049041daf68f070fcb47e1e69511f5cd2029b7185220ec983f066214d286"
    },
    {
      "role": "pdf-source",
      "path": "2503.23653v2.pdf",
      "format": "application/pdf",
      "bytes": 8012292,
      "sha256": "6cf3f9e3237092cc9572f1e0e812d00006fbfffca2a6b013d18d90990631931a"
    }
  ],
  "validation": {
    "status": "valid",
    "validated_utc": "2026-08-11T08:29:53.804988Z",
    "publication": "published-new-tree",
    "checks": [
      {
        "name": "gzip-readable",
        "outcome": "passed",
        "archive_kind": "tar+gzip"
      },
      {
        "name": "archive-members-confined",
        "outcome": "passed",
        "entries": 30
      },
      {
        "name": "no-links-or-reparse-points",
        "outcome": "passed",
        "files": 29
      },
      {
        "name": "tex-valid-utf8",
        "outcome": "passed",
        "tex_files": 1
      },
      {
        "name": "entrypoint-unambiguous",
        "outcome": "passed",
        "entrypoint": "main.tex",
        "selection": "single-candidate"
      },
      {
        "name": "literal-inputs-resolved",
        "outcome": "passed",
        "unresolved_input_action": "Stop"
      },
      {
        "name": "document-environment-present",
        "outcome": "passed",
        "basis": "resolved-input-text"
      }
    ]
  }
}
