{
  "schema": "codex-scientiae/article/0.1",
  "state": "source-ready",
  "slug": "2106.06375v1",
  "initialized_utc": "2026-08-11T08:29:46.436428Z",
  "title": null,
  "authors": [],
  "abstract": null,
  "identifiers": {
    "arxiv": null,
    "arxiv_versioned": null,
    "doi": null
  },
  "categories": [],
  "primary_category": null,
  "published": null,
  "updated": null,
  "evidence": {
    "provider_metadata": [],
    "latex_source": {
      "entrypoint": "spnormal.tex",
      "selection": "single-candidate",
      "declarations": {
        "title_tex": "Parameter Estimation and Model-Based Clustering with Spherical Normal Distribution on the Unit Hypersphere",
        "authors_tex": [
          "Kisung You"
        ],
        "doi": null
      }
    },
    "package_control_files": []
  },
  "source_forms": [
    {
      "role": "latex-source-archive",
      "path": "2106.06375v1.tar.gz",
      "format": "application/gzip",
      "bytes": 12871984,
      "sha256": "8802b13af265b755164ed8ea92e4bce5c52ce8adc66c122dd558d666f92333d8",
      "archive_kind": "tar+gzip"
    },
    {
      "role": "latex-source-tree",
      "path": "2106.06375v1-tex",
      "format": "application/x-latex-source-tree",
      "derived_from": "2106.06375v1.tar.gz",
      "entrypoint": "spnormal.tex",
      "entrypoint_selection": "single-candidate",
      "files": 21,
      "tex_files": 1,
      "sha256": "9ce3af78ebcb5e867c93b6e65ff69ce5d04f1c94d965b98475b472c515f88f13"
    },
    {
      "role": "pdf-source",
      "path": "2106.06375v1.pdf",
      "format": "application/pdf",
      "bytes": 7105691,
      "sha256": "99930aa8771adb8bc7bc76fe0a5ee0580a6ee9fa5740aa59d09f5d03fe8caa20"
    }
  ],
  "validation": {
    "status": "valid",
    "validated_utc": "2026-08-11T08:29:46.436428Z",
    "publication": "published-new-tree",
    "checks": [
      {
        "name": "gzip-readable",
        "outcome": "passed",
        "archive_kind": "tar+gzip"
      },
      {
        "name": "archive-members-confined",
        "outcome": "passed",
        "entries": 22
      },
      {
        "name": "no-links-or-reparse-points",
        "outcome": "passed",
        "files": 21
      },
      {
        "name": "tex-valid-utf8",
        "outcome": "passed",
        "tex_files": 1
      },
      {
        "name": "entrypoint-unambiguous",
        "outcome": "passed",
        "entrypoint": "spnormal.tex",
        "selection": "single-candidate"
      },
      {
        "name": "literal-inputs-resolved",
        "outcome": "passed",
        "unresolved_input_action": "Stop"
      },
      {
        "name": "document-environment-present",
        "outcome": "passed",
        "basis": "resolved-input-text"
      }
    ]
  }
}
