{
  "schema": "codex-scientiae/article/0.1",
  "state": "source-ready",
  "slug": "2302.12796v2",
  "initialized_utc": "2026-08-11T08:30:33.131125Z",
  "title": null,
  "authors": [],
  "abstract": null,
  "identifiers": {
    "arxiv": null,
    "arxiv_versioned": null,
    "doi": null
  },
  "categories": [],
  "primary_category": null,
  "published": null,
  "updated": null,
  "evidence": {
    "provider_metadata": [],
    "latex_source": {
      "entrypoint": "Arxiv_graph_pers_up.tex",
      "selection": "single-candidate",
      "declarations": {
        "title_tex": "Revisiting Graph Persistence for Updates and Efficiency\\thanks{This research is partially supported by NSF grant CCF 2049010.}",
        "authors_tex": [
          "Tamal K. Dey\\thanks{Department of Computer Science, Purdue University. \\texttt{tamaldey@purdue.edu}}\n\\and Tao Hou\\thanks{School of Computing, DePaul University. \\texttt{thou1@depaul.edu}}\n\\and Salman Parsa\\thanks{School of Computing, DePaul University. \\texttt{s.parsa@depaul.edu}}"
        ],
        "doi": null
      }
    },
    "package_control_files": []
  },
  "source_forms": [
    {
      "role": "latex-source-archive",
      "path": "2302.12796v2.tar.gz",
      "format": "application/gzip",
      "bytes": 65717,
      "sha256": "8b4020231283cd7db6b8caeb038d38f93ca18108461e7f00209c7b5e44dfd8e1",
      "archive_kind": "tar+gzip"
    },
    {
      "role": "latex-source-tree",
      "path": "2302.12796v2-tex",
      "format": "application/x-latex-source-tree",
      "derived_from": "2302.12796v2.tar.gz",
      "entrypoint": "Arxiv_graph_pers_up.tex",
      "entrypoint_selection": "single-candidate",
      "files": 12,
      "tex_files": 1,
      "sha256": "cbaaca995ada4783d280b4bb416a3d5087ed327b83f95560352868c19e5766d7"
    },
    {
      "role": "pdf-source",
      "path": "2302.12796v2.pdf",
      "format": "application/pdf",
      "bytes": 605480,
      "sha256": "9b20ee3fb47a439a65915bb6e6c797db0364fa05a1731b974ceaff0678c3c2fd"
    }
  ],
  "validation": {
    "status": "valid",
    "validated_utc": "2026-08-11T08:30:33.131125Z",
    "publication": "published-new-tree",
    "checks": [
      {
        "name": "gzip-readable",
        "outcome": "passed",
        "archive_kind": "tar+gzip"
      },
      {
        "name": "archive-members-confined",
        "outcome": "passed",
        "entries": 13
      },
      {
        "name": "no-links-or-reparse-points",
        "outcome": "passed",
        "files": 12
      },
      {
        "name": "tex-valid-utf8",
        "outcome": "passed",
        "tex_files": 1
      },
      {
        "name": "entrypoint-unambiguous",
        "outcome": "passed",
        "entrypoint": "Arxiv_graph_pers_up.tex",
        "selection": "single-candidate"
      },
      {
        "name": "literal-inputs-resolved",
        "outcome": "passed",
        "unresolved_input_action": "Stop"
      },
      {
        "name": "document-environment-present",
        "outcome": "passed",
        "basis": "resolved-input-text"
      }
    ]
  }
}
