{
  "schema": "codex-scientiae/article/0.1",
  "state": "source-ready",
  "slug": "1509.05064v1",
  "initialized_utc": "2026-08-11T08:30:49.806673Z",
  "title": null,
  "authors": [],
  "abstract": null,
  "identifiers": {
    "arxiv": null,
    "arxiv_versioned": null,
    "doi": null
  },
  "categories": [],
  "primary_category": null,
  "published": null,
  "updated": null,
  "evidence": {
    "provider_metadata": [],
    "latex_source": {
      "entrypoint": "main.tex",
      "selection": "single-candidate",
      "declarations": {
        "title_tex": "Exact simultaneous recovery of locations and structure from known orientations and corrupted point correspondences.",
        "authors_tex": [
          "Paul Hand*, Choongbum Lee and Vladislav Voroninski\\\\\n  Department of Mathematics, Massachusetts Institute of Technology\\\\\n  *Department of Computational and Applied Mathematics, Rice University"
        ],
        "doi": null
      }
    },
    "package_control_files": []
  },
  "source_forms": [
    {
      "role": "latex-source-archive",
      "path": "1509.05064v1.tar.gz",
      "format": "application/gzip",
      "bytes": 52193,
      "sha256": "c88efffdc17ec845ed4995c9517c86f6e175a8890793224645e1952834bf1515",
      "archive_kind": "tar+gzip"
    },
    {
      "role": "latex-source-tree",
      "path": "1509.05064v1-tex",
      "format": "application/x-latex-source-tree",
      "derived_from": "1509.05064v1.tar.gz",
      "entrypoint": "main.tex",
      "entrypoint_selection": "single-candidate",
      "files": 10,
      "tex_files": 7,
      "sha256": "2bd3d64106c4d19ab4a5785f894f5f36723e65681974852dea0b788c546af9a6"
    },
    {
      "role": "pdf-source",
      "path": "1509.05064v1.pdf",
      "format": "application/pdf",
      "bytes": 326297,
      "sha256": "0f60f1af8969be8718b9afd43d5a905517dd30271c9a761fa6af5b70a1a6c177"
    }
  ],
  "validation": {
    "status": "valid",
    "validated_utc": "2026-08-11T08:30:49.806673Z",
    "publication": "published-new-tree",
    "checks": [
      {
        "name": "gzip-readable",
        "outcome": "passed",
        "archive_kind": "tar+gzip"
      },
      {
        "name": "archive-members-confined",
        "outcome": "passed",
        "entries": 10
      },
      {
        "name": "no-links-or-reparse-points",
        "outcome": "passed",
        "files": 10
      },
      {
        "name": "tex-valid-utf8",
        "outcome": "passed",
        "tex_files": 7
      },
      {
        "name": "entrypoint-unambiguous",
        "outcome": "passed",
        "entrypoint": "main.tex",
        "selection": "single-candidate"
      },
      {
        "name": "literal-inputs-resolved",
        "outcome": "passed",
        "unresolved_input_action": "Stop"
      },
      {
        "name": "document-environment-present",
        "outcome": "passed",
        "basis": "resolved-input-text"
      }
    ]
  }
}
