{
  "schema": "codex-scientiae/article/0.1",
  "state": "source-ready",
  "slug": "2603.03037v1",
  "initialized_utc": "2026-08-11T08:30:39.282085Z",
  "title": null,
  "authors": [],
  "abstract": null,
  "identifiers": {
    "arxiv": null,
    "arxiv_versioned": null,
    "doi": null
  },
  "categories": [],
  "primary_category": null,
  "published": null,
  "updated": null,
  "evidence": {
    "provider_metadata": [],
    "latex_source": {
      "entrypoint": "main_arxiv.tex",
      "selection": "single-candidate",
      "declarations": {
        "title_tex": "Zigzag Persistence of Neural Responses to Time-Varying Stimuli",
        "authors_tex": [
          "Yuri Gardinazzi",
          "Alessio Ansuini",
          "Eugenio Piasini",
          "Fabio Anselmi",
          "Matteo Biagetti\\thanks{For correspondence: matteo.biagetti@areasciencepark.it}"
        ],
        "doi": null
      }
    },
    "package_control_files": [
      {
        "path": "00README.json",
        "bytes": 300,
        "sha256": "2b93aacac5448a8958dff825e648ba46ab735ced8f03855f74cf8f204623b520"
      }
    ]
  },
  "source_forms": [
    {
      "role": "latex-source-archive",
      "path": "2603.03037v1.tar.gz",
      "format": "application/gzip",
      "bytes": 3122544,
      "sha256": "bcf2902d529484200b2fa68c3d0a9a2b6797b2b5c7fc5a5c6797e8fd898d1cf2",
      "archive_kind": "tar+gzip"
    },
    {
      "role": "latex-source-tree",
      "path": "2603.03037v1-tex",
      "format": "application/x-latex-source-tree",
      "derived_from": "2603.03037v1.tar.gz",
      "entrypoint": "main_arxiv.tex",
      "entrypoint_selection": "single-candidate",
      "files": 18,
      "tex_files": 1,
      "sha256": "6833aadceb7d50075b7d23f83b3568da810e7bb1c07be68a82173a72696cf31e"
    },
    {
      "role": "pdf-source",
      "path": "2603.03037v1.pdf",
      "format": "application/pdf",
      "bytes": 984922,
      "sha256": "b1d8377d46f1f80ddd932388d8cf2812e3ff656b4b3fd773e83acc24f524625e"
    }
  ],
  "validation": {
    "status": "valid",
    "validated_utc": "2026-08-11T08:30:39.282085Z",
    "publication": "published-new-tree",
    "checks": [
      {
        "name": "gzip-readable",
        "outcome": "passed",
        "archive_kind": "tar+gzip"
      },
      {
        "name": "archive-members-confined",
        "outcome": "passed",
        "entries": 19
      },
      {
        "name": "no-links-or-reparse-points",
        "outcome": "passed",
        "files": 18
      },
      {
        "name": "tex-valid-utf8",
        "outcome": "passed",
        "tex_files": 1
      },
      {
        "name": "entrypoint-unambiguous",
        "outcome": "passed",
        "entrypoint": "main_arxiv.tex",
        "selection": "single-candidate"
      },
      {
        "name": "literal-inputs-resolved",
        "outcome": "passed",
        "unresolved_input_action": "Stop"
      },
      {
        "name": "document-environment-present",
        "outcome": "passed",
        "basis": "resolved-input-text"
      }
    ]
  }
}
