{
  "schema": "codex-scientiae/article/0.1",
  "state": "source-ready",
  "slug": "2506.07658v3",
  "initialized_utc": "2026-08-11T03:19:31.140093Z",
  "title": null,
  "authors": [],
  "abstract": null,
  "identifiers": {
    "arxiv": null,
    "arxiv_versioned": null,
    "doi": null
  },
  "categories": [],
  "primary_category": null,
  "published": null,
  "updated": null,
  "evidence": {
    "provider_metadata": [],
    "latex_source": {
      "entrypoint": "main.tex",
      "selection": "single-candidate",
      "declarations": {
        "title_tex": "From Raw Corpora to Domain Benchmarks: Automated Evaluation of LLM Domain Expertise",
        "authors_tex": [
          "\\name Nitin Sharma \\\\\n      \\addr Department of Psychiatry and Psychotherapy\\\\\n      University Hospital Tübingen, Germany\n      \\AND\n      \\name Thomas Wolfers \\\\\n      \\addr Laboratory for Mental Health Mapping \\\\ Carl Zeiss Professor for AI in Neural Systems Imaging\\\\\n      Friedrich Schiller University Jena, Germany\n      \\AND\n      \\name Çağatay Yıldız \\\\\n      \\addr Cluster of Excellence Machine Learning for Science\\\\\n      University of Tübingen, Germany"
        ],
        "doi": null
      }
    },
    "package_control_files": [
      {
        "path": "00README.json",
        "bytes": 213,
        "sha256": "d1f6b1a71c9accb812ec5121d1fff7910c025ca7bb201948bacdb40941bc14e5"
      }
    ]
  },
  "source_forms": [
    {
      "role": "latex-source-archive",
      "path": "2506.07658v3.tar.gz",
      "format": "application/gzip",
      "bytes": 18168236,
      "sha256": "8d61c266226b6f9f49709b28984e5e85c3e324eb03ae6808a3318f2c47a22547",
      "archive_kind": "tar+gzip"
    },
    {
      "role": "latex-source-tree",
      "path": "2506.07658v3-tex",
      "format": "application/x-latex-source-tree",
      "derived_from": "2506.07658v3.tar.gz",
      "entrypoint": "main.tex",
      "entrypoint_selection": "single-candidate",
      "files": 38,
      "tex_files": 2,
      "sha256": "163fd4c813f5b2e41a99a9ee02d54fdf992dc527d8cc670ecafcc52137b11f35"
    }
  ],
  "validation": {
    "status": "valid",
    "validated_utc": "2026-08-11T03:19:31.140093Z",
    "publication": "published-new-tree",
    "checks": [
      {
        "name": "gzip-readable",
        "outcome": "passed",
        "archive_kind": "tar+gzip"
      },
      {
        "name": "archive-members-confined",
        "outcome": "passed",
        "entries": 50
      },
      {
        "name": "no-links-or-reparse-points",
        "outcome": "passed",
        "files": 38
      },
      {
        "name": "tex-valid-utf8",
        "outcome": "passed",
        "tex_files": 2
      },
      {
        "name": "entrypoint-unambiguous",
        "outcome": "passed",
        "entrypoint": "main.tex",
        "selection": "single-candidate"
      },
      {
        "name": "literal-inputs-resolved",
        "outcome": "passed",
        "unresolved_input_action": "Stop"
      },
      {
        "name": "document-environment-present",
        "outcome": "passed",
        "basis": "resolved-input-text"
      }
    ]
  }
}
