{
  "schema": "codex-scientiae/article/0.1",
  "state": "source-ready",
  "slug": "2506.05725v1",
  "initialized_utc": "2026-08-11T03:19:28.112024Z",
  "title": null,
  "authors": [],
  "abstract": null,
  "identifiers": {
    "arxiv": null,
    "arxiv_versioned": null,
    "doi": null
  },
  "categories": [],
  "primary_category": null,
  "published": null,
  "updated": null,
  "evidence": {
    "provider_metadata": [],
    "latex_source": {
      "entrypoint": "main.tex",
      "selection": "single-candidate",
      "declarations": {
        "title_tex": "Large Language Models are Good Relational Learners",
        "authors_tex": [
          "Fang Wu  \\\\  Stanford University  \\\\\n  \\texttt{fangwu97@stanford.edu} \\\\\\And\n  Vijay Prakash Dwivedi\\\\\n  Stanford University  \\\\\n  \\texttt{vdwivedi@cs.stanford.edu} \\\\\\And\n  Jure Leskovec$^\\dagger$  \\\\\n  Stanford University  \\\\\n  \\texttt{jure@cs.stanford.edu}"
        ],
        "doi": null
      }
    },
    "package_control_files": [
      {
        "path": "00README.json",
        "bytes": 342,
        "sha256": "da86945ce19c8054b58f3aea4f0d98496dbb59c7978e301bef61c37f7d155fa6"
      }
    ]
  },
  "source_forms": [
    {
      "role": "latex-source-archive",
      "path": "2506.05725v1.tar.gz",
      "format": "application/gzip",
      "bytes": 1275476,
      "sha256": "1e40f35d8bfba550f59162e04cbe75ac6dcc10b7c269d6719e5151896ebb4abc",
      "archive_kind": "tar+gzip"
    },
    {
      "role": "latex-source-tree",
      "path": "2506.05725v1-tex",
      "format": "application/x-latex-source-tree",
      "derived_from": "2506.05725v1.tar.gz",
      "entrypoint": "main.tex",
      "entrypoint_selection": "single-candidate",
      "files": 12,
      "tex_files": 1,
      "sha256": "ca0a5d4978cd63ea0cf6aa03bd7aa91bd9af8b2635bc13ad203e5af01678a296"
    }
  ],
  "validation": {
    "status": "valid",
    "validated_utc": "2026-08-11T03:19:28.112024Z",
    "publication": "published-new-tree",
    "checks": [
      {
        "name": "gzip-readable",
        "outcome": "passed",
        "archive_kind": "tar+gzip"
      },
      {
        "name": "archive-members-confined",
        "outcome": "passed",
        "entries": 13
      },
      {
        "name": "no-links-or-reparse-points",
        "outcome": "passed",
        "files": 12
      },
      {
        "name": "tex-valid-utf8",
        "outcome": "passed",
        "tex_files": 1
      },
      {
        "name": "entrypoint-unambiguous",
        "outcome": "passed",
        "entrypoint": "main.tex",
        "selection": "single-candidate"
      },
      {
        "name": "literal-inputs-resolved",
        "outcome": "passed",
        "unresolved_input_action": "Stop"
      },
      {
        "name": "document-environment-present",
        "outcome": "passed",
        "basis": "resolved-input-text"
      }
    ]
  }
}
