{
  "schema": "codex-scientiae/article/0.1",
  "state": "source-ready",
  "slug": "1309.7669v1",
  "initialized_utc": "2026-08-11T08:30:47.265111Z",
  "title": null,
  "authors": [],
  "abstract": null,
  "identifiers": {
    "arxiv": null,
    "arxiv_versioned": null,
    "doi": null
  },
  "categories": [],
  "primary_category": null,
  "published": null,
  "updated": null,
  "evidence": {
    "provider_metadata": [],
    "latex_source": {
      "entrypoint": "chap3.tex",
      "selection": "single-candidate",
      "declarations": {
        "title_tex": "Quantum tomography from few full-rank observables.",
        "authors_tex": [
          "Vladislav Voroninski\\\\\n  \\vspace{-.1cm}\\\\\n  Department of Mathematics, Massachusetts Institute of Technology."
        ],
        "doi": null
      }
    },
    "package_control_files": []
  },
  "source_forms": [
    {
      "role": "latex-source-archive",
      "path": "1309.7669v1.tar.gz",
      "format": "application/gzip",
      "bytes": 12801,
      "sha256": "b09b9ab6455c69bd07d51c4a47b652399bffe2de6f5492e9ea0b6a57540d9fa5",
      "archive_kind": "tar+gzip"
    },
    {
      "role": "latex-source-tree",
      "path": "1309.7669v1-tex",
      "format": "application/x-latex-source-tree",
      "derived_from": "1309.7669v1.tar.gz",
      "entrypoint": "chap3.tex",
      "entrypoint_selection": "single-candidate",
      "files": 2,
      "tex_files": 1,
      "sha256": "e8715736821c25c43d86e482bf3e216dbd2eda9c4be0ac5685efd26de8c98744"
    },
    {
      "role": "pdf-source",
      "path": "1309.7669v1.pdf",
      "format": "application/pdf",
      "bytes": 158899,
      "sha256": "46b7bb47a80f2ee14dffaa091a3a4f3964964b14d3fc0abd6818925c70de9cdd"
    }
  ],
  "validation": {
    "status": "valid",
    "validated_utc": "2026-08-11T08:30:47.265111Z",
    "publication": "published-new-tree",
    "checks": [
      {
        "name": "gzip-readable",
        "outcome": "passed",
        "archive_kind": "tar+gzip"
      },
      {
        "name": "archive-members-confined",
        "outcome": "passed",
        "entries": 2
      },
      {
        "name": "no-links-or-reparse-points",
        "outcome": "passed",
        "files": 2
      },
      {
        "name": "tex-valid-utf8",
        "outcome": "passed",
        "tex_files": 1
      },
      {
        "name": "entrypoint-unambiguous",
        "outcome": "passed",
        "entrypoint": "chap3.tex",
        "selection": "single-candidate"
      },
      {
        "name": "literal-inputs-resolved",
        "outcome": "passed",
        "unresolved_input_action": "Stop"
      },
      {
        "name": "document-environment-present",
        "outcome": "passed",
        "basis": "resolved-input-text"
      }
    ]
  }
}
