{
  "schema": "codex-scientiae/article/0.1",
  "state": "source-ready",
  "slug": "2204.11080v2",
  "initialized_utc": "2026-08-11T08:30:28.847912Z",
  "title": null,
  "authors": [],
  "abstract": null,
  "identifiers": {
    "arxiv": null,
    "arxiv_versioned": null,
    "doi": null
  },
  "categories": [],
  "primary_category": null,
  "published": null,
  "updated": null,
  "evidence": {
    "provider_metadata": [],
    "latex_source": {
      "entrypoint": "fast_zigzag_arxiv.tex",
      "selection": "single-candidate",
      "declarations": {
        "title_tex": "Fast Computation of Zigzag Persistence\\thanks{This research is partially supported by NSF grant CCF 2049010.}",
        "authors_tex": [
          "Tamal K. Dey\\thanks{Department of Computer Science, Purdue University. \\texttt{tamaldey@purdue.edu}}\n\\and Tao Hou\\thanks{School of Computing, DePaul University. \\texttt{taohou01@gmail.com}}"
        ],
        "doi": null
      }
    },
    "package_control_files": []
  },
  "source_forms": [
    {
      "role": "latex-source-archive",
      "path": "2204.11080v2.tar.gz",
      "format": "application/gzip",
      "bytes": 73325,
      "sha256": "f6ec3d02989ece12476e4aa0f50c71ecab2811a71838e7c2e3f8df9e8da31941",
      "archive_kind": "tar+gzip"
    },
    {
      "role": "latex-source-tree",
      "path": "2204.11080v2-tex",
      "format": "application/x-latex-source-tree",
      "derived_from": "2204.11080v2.tar.gz",
      "entrypoint": "fast_zigzag_arxiv.tex",
      "entrypoint_selection": "single-candidate",
      "files": 10,
      "tex_files": 1,
      "sha256": "2bbf42795eb13314f5b37c0a1463fa4bd909428cf58e0346107f45e3ca209f62"
    },
    {
      "role": "pdf-source",
      "path": "2204.11080v2.pdf",
      "format": "application/pdf",
      "bytes": 519568,
      "sha256": "07d70900747e19b84ddcec679d99afcb6d485256116da16403ca88de18c8ae48"
    }
  ],
  "validation": {
    "status": "valid",
    "validated_utc": "2026-08-11T08:30:28.847912Z",
    "publication": "published-new-tree",
    "checks": [
      {
        "name": "gzip-readable",
        "outcome": "passed",
        "archive_kind": "tar+gzip"
      },
      {
        "name": "archive-members-confined",
        "outcome": "passed",
        "entries": 11
      },
      {
        "name": "no-links-or-reparse-points",
        "outcome": "passed",
        "files": 10
      },
      {
        "name": "tex-valid-utf8",
        "outcome": "passed",
        "tex_files": 1
      },
      {
        "name": "entrypoint-unambiguous",
        "outcome": "passed",
        "entrypoint": "fast_zigzag_arxiv.tex",
        "selection": "single-candidate"
      },
      {
        "name": "literal-inputs-resolved",
        "outcome": "passed",
        "unresolved_input_action": "Stop"
      },
      {
        "name": "document-environment-present",
        "outcome": "passed",
        "basis": "resolved-input-text"
      }
    ]
  }
}
