{
  "schema": "codex-scientiae/article/0.1",
  "state": "source-ready",
  "slug": "2408.11180v1",
  "initialized_utc": "2026-08-11T08:30:15.357883Z",
  "title": null,
  "authors": [],
  "abstract": null,
  "identifiers": {
    "arxiv": null,
    "arxiv_versioned": null,
    "doi": null
  },
  "categories": [],
  "primary_category": null,
  "published": null,
  "updated": null,
  "evidence": {
    "provider_metadata": [],
    "latex_source": {
      "entrypoint": "any_graph_mapper.tex",
      "selection": "single-candidate",
      "declarations": {
        "title_tex": "Any Graph is a Mapper Graph",
        "authors_tex": [
          "Enrique G Alvarado",
          "Robin Belton",
          "Kang-Ju Lee",
          "Sourabh Palande",
          "Sarah Percival",
          "Emilie Purvine",
          "Sarah Tymochko"
        ],
        "doi": null
      }
    },
    "package_control_files": []
  },
  "source_forms": [
    {
      "role": "latex-source-archive",
      "path": "2408.11180v1.tar.gz",
      "format": "application/gzip",
      "bytes": 345764,
      "sha256": "0d14b649974f016a6766f5ca3158193a252f9b6985e0bdddbed84151800fc342",
      "archive_kind": "tar+gzip"
    },
    {
      "role": "latex-source-tree",
      "path": "2408.11180v1-tex",
      "format": "application/x-latex-source-tree",
      "derived_from": "2408.11180v1.tar.gz",
      "entrypoint": "any_graph_mapper.tex",
      "entrypoint_selection": "single-candidate",
      "files": 6,
      "tex_files": 1,
      "sha256": "35cb10d7163a62dd51133fab9abcc3d07b138e731330aafc21dbdaf045f6b95a"
    },
    {
      "role": "pdf-source",
      "path": "2408.11180v1.pdf",
      "format": "application/pdf",
      "bytes": 1469163,
      "sha256": "f8ab5505fc2fcc8820a81097d419ece97f30294d0af2a0f7d85e7d4d1318ef4f"
    }
  ],
  "validation": {
    "status": "valid",
    "validated_utc": "2026-08-11T08:30:15.357883Z",
    "publication": "published-new-tree",
    "checks": [
      {
        "name": "gzip-readable",
        "outcome": "passed",
        "archive_kind": "tar+gzip"
      },
      {
        "name": "archive-members-confined",
        "outcome": "passed",
        "entries": 7
      },
      {
        "name": "no-links-or-reparse-points",
        "outcome": "passed",
        "files": 6
      },
      {
        "name": "tex-valid-utf8",
        "outcome": "passed",
        "tex_files": 1
      },
      {
        "name": "entrypoint-unambiguous",
        "outcome": "passed",
        "entrypoint": "any_graph_mapper.tex",
        "selection": "single-candidate"
      },
      {
        "name": "literal-inputs-resolved",
        "outcome": "passed",
        "unresolved_input_action": "Stop"
      },
      {
        "name": "document-environment-present",
        "outcome": "passed",
        "basis": "resolved-input-text"
      }
    ]
  }
}
