{
  "schema": "codex-scientiae/article/0.1",
  "state": "source-ready",
  "slug": "2602.05522v1",
  "initialized_utc": "2026-08-11T08:30:22.243253Z",
  "title": null,
  "authors": [],
  "abstract": null,
  "identifiers": {
    "arxiv": null,
    "arxiv_versioned": null,
    "doi": null
  },
  "categories": [],
  "primary_category": null,
  "published": null,
  "updated": null,
  "evidence": {
    "provider_metadata": [],
    "latex_source": {
      "entrypoint": "Mapper-GIN_arXiv.tex",
      "selection": "single-candidate",
      "declarations": {
        "title_tex": "Mapper-GIN: Lightweight Structural Graph Abstraction for Corrupted 3D Point Cloud Classification",
        "authors_tex": [
          "Jeongbin You \\\\\n  Department of Mathematics \\\\\n  Korea University \\\\\n  \\texttt{dbwjdqls03@gmail.com} \\\\\n  \\And\n  Donggun Kim \\\\\n  Department of Mathematics \\\\\n  Korea University \\\\\n  \\texttt{dorage1105@korea.ac.kr} \\\\\n  \\And\n  Sejun Park \\\\\n  Department of Mathematics \\\\\n  Korea University \\\\\n  \\texttt{safespot@korea.ac.kr} \\\\\n  \\And\n  Seungsang Oh \\\\\n  Department of Mathematics \\\\\n  Korea University \\\\\n  \\texttt{seungsang@korea.ac.kr} \\\\"
        ],
        "doi": null
      }
    },
    "package_control_files": [
      {
        "path": "00README.json",
        "bytes": 225,
        "sha256": "e773be5af814a400125cefd58326a9992d6931296160c21817e06b27c0f43c0a"
      }
    ]
  },
  "source_forms": [
    {
      "role": "latex-source-archive",
      "path": "2602.05522v1.tar.gz",
      "format": "application/gzip",
      "bytes": 1523142,
      "sha256": "e3500ec2a2c457b8802b7bdf0c61ddb59350c5a69f5f7ae4feede0a8a316288a",
      "archive_kind": "tar+gzip"
    },
    {
      "role": "latex-source-tree",
      "path": "2602.05522v1-tex",
      "format": "application/x-latex-source-tree",
      "derived_from": "2602.05522v1.tar.gz",
      "entrypoint": "Mapper-GIN_arXiv.tex",
      "entrypoint_selection": "single-candidate",
      "files": 9,
      "tex_files": 1,
      "sha256": "74117945f72512bd2cebdb31fba4a2bbde43b83c5fc858eba9fc696977c11699"
    },
    {
      "role": "pdf-source",
      "path": "2602.05522v1.pdf",
      "format": "application/pdf",
      "bytes": 2059318,
      "sha256": "30ba93b0b480f2c63ebba6f31e50e06a03100fe6587370510f1b9453680ef5cf"
    }
  ],
  "validation": {
    "status": "valid",
    "validated_utc": "2026-08-11T08:30:22.243253Z",
    "publication": "published-new-tree",
    "checks": [
      {
        "name": "gzip-readable",
        "outcome": "passed",
        "archive_kind": "tar+gzip"
      },
      {
        "name": "archive-members-confined",
        "outcome": "passed",
        "entries": 10
      },
      {
        "name": "no-links-or-reparse-points",
        "outcome": "passed",
        "files": 9
      },
      {
        "name": "tex-valid-utf8",
        "outcome": "passed",
        "tex_files": 1
      },
      {
        "name": "entrypoint-unambiguous",
        "outcome": "passed",
        "entrypoint": "Mapper-GIN_arXiv.tex",
        "selection": "single-candidate"
      },
      {
        "name": "literal-inputs-resolved",
        "outcome": "passed",
        "unresolved_input_action": "Stop"
      },
      {
        "name": "document-environment-present",
        "outcome": "passed",
        "basis": "resolved-input-text"
      }
    ]
  }
}
